{
  "story_id": "fuxduxian",
  "year": 4,
  "scene_type": "special",
  "mood": "试探·暖",
  "status": "draft",
  "narrative_ref": {
    "memory_id": "m4",
    "event_summary": "舞台侧幕"
  },
  "background": {
    "asset_id": "PX-PLACEHOLDER-004",
    "parallax": 0.2
  },
  "layers": [
    {
      "asset_id": "PX-CHAR-ALAN",
      "role": "protagonist",
      "x": 320,
      "y": 220,
      "depth": 2,
      "animation": "edit_speech"
    },
    {
      "asset_id": "PX-PROP-STAGE",
      "role": "prop",
      "x": 180,
      "y": 240,
      "depth": 1
    },
    {
      "asset_id": "PX-PROP-TIE",
      "role": "prop",
      "x": 300,
      "y": 240,
      "depth": 1
    }
  ],
  "daily_loops": [
    {
      "id": "edit_speech",
      "asset_id": "PX-CHAR-ALAN",
      "animation": "edit_speech",
      "trigger": "year_idle"
    }
  ],
  "sequence": [
    {
      "duration_ms": 800,
      "camera": "fade_in"
    },
    {
      "duration_ms": 1200,
      "camera": "hold"
    },
    {
      "duration_ms": 600,
      "camera": "fade_out"
    }
  ]
}
