{
  "story_id": "fuxduxian",
  "year": 2,
  "scene_type": "special",
  "mood": "麻木·夜",
  "status": "draft",
  "narrative_ref": {
    "memory_id": "m2",
    "event_summary": "查分夜撕准考证"
  },
  "background": {
    "asset_id": "PX-PLACEHOLDER-002",
    "parallax": 0.2
  },
  "layers": [
    {
      "asset_id": "PX-CHAR-ALAN",
      "role": "protagonist",
      "x": 320,
      "y": 220,
      "depth": 2,
      "animation": "tear_paper"
    },
    {
      "asset_id": "PX-PROP-DESK",
      "role": "prop",
      "x": 180,
      "y": 240,
      "depth": 1
    },
    {
      "asset_id": "PX-PROP-PAPER",
      "role": "prop",
      "x": 300,
      "y": 240,
      "depth": 1
    }
  ],
  "daily_loops": [
    {
      "id": "tear_paper",
      "asset_id": "PX-CHAR-ALAN",
      "animation": "tear_paper",
      "trigger": "year_idle"
    }
  ]
}
