{
  "story_id": "fuxduxian",
  "year": 1,
  "scene_type": "special",
  "mood": "灰冷·退缩",
  "status": "draft",
  "narrative_ref": {
    "memory_id": "m1",
    "event_summary": "雨天最后一排"
  },
  "background": {
    "asset_id": "PX-PLACEHOLDER-001",
    "parallax": 0.2
  },
  "layers": [
    {
      "asset_id": "PX-CHAR-ALAN",
      "role": "protagonist",
      "x": 320,
      "y": 220,
      "depth": 2,
      "animation": "read_idle"
    },
    {
      "asset_id": "PX-PROP-DESK",
      "role": "prop",
      "x": 180,
      "y": 240,
      "depth": 1
    },
    {
      "asset_id": "PX-PROP-BAG",
      "role": "prop",
      "x": 300,
      "y": 240,
      "depth": 1
    }
  ],
  "daily_loops": [
    {
      "id": "read_idle",
      "asset_id": "PX-CHAR-ALAN",
      "animation": "read_idle",
      "trigger": "year_idle"
    }
  ],
  "sequence": [
    {
      "duration_ms": 800,
      "camera": "fade_in"
    },
    {
      "duration_ms": 1200,
      "camera": "hold"
    },
    {
      "duration_ms": 600,
      "camera": "fade_out"
    }
  ]
}
