{
  "story_id": "fuxduxian",
  "year": 7,
  "scene_type": "special",
  "mood": "稳·留白",
  "status": "draft",
  "narrative_ref": {
    "memory_id": "m7",
    "event_summary": "邮局小窗"
  },
  "background": {
    "asset_id": "PX-PLACEHOLDER-007",
    "parallax": 0.2
  },
  "layers": [
    {
      "asset_id": "PX-CHAR-ALAN",
      "role": "protagonist",
      "x": 320,
      "y": 220,
      "depth": 2,
      "animation": "write_idle"
    },
    {
      "asset_id": "PX-PROP-DESK",
      "role": "prop",
      "x": 180,
      "y": 240,
      "depth": 1
    },
    {
      "asset_id": "PX-PROP-PEN",
      "role": "prop",
      "x": 300,
      "y": 240,
      "depth": 1
    }
  ],
  "daily_loops": [
    {
      "id": "write_idle",
      "asset_id": "PX-CHAR-ALAN",
      "animation": "write_idle",
      "trigger": "year_idle"
    }
  ],
  "sequence": [
    {
      "duration_ms": 800,
      "camera": "fade_in"
    },
    {
      "duration_ms": 1200,
      "camera": "hold"
    },
    {
      "duration_ms": 600,
      "camera": "fade_out"
    }
  ]
}
